{
  "$schema": "../schemas/certification-seed-catalog.schema.json",
  "schema_version": 1,
  "lifecycle_as_of": "2026-09-30",
  "catalog_sources": [
    {
      "id": "github-published-guides",
      "vendor_id": "github",
      "catalog_url": "https://resources.github.com/learn/certifications/",
      "selection": "GitHub credentials that already have published guides in this library; this source does not claim broader GitHub catalog coverage.",
      "last_verified": "2026-08-31"
    },
    {
      "id": "microsoft-azure-current",
      "vendor_id": "microsoft",
      "catalog_url": "https://learn.microsoft.com/en-us/credentials/browse/?credential_types=certification&products=azure",
      "selection": "Every current certification returned by the official Microsoft Learn credential catalog with credential type Certification and product Azure, represented by one row for each required exam.",
      "last_verified": "2026-08-31"
    },
    {
      "id": "microsoft-published-outside-azure",
      "vendor_id": "microsoft",
      "catalog_url": "https://learn.microsoft.com/en-us/credentials/browse/?credential_types=certification",
      "selection": "Microsoft certifications outside the Azure product facet that already have published guides in this library.",
      "last_verified": "2026-09-01"
    },
    {
      "id": "microsoft-azure-adjacent-current",
      "vendor_id": "microsoft",
      "catalog_url": "https://learn.microsoft.com/en-us/credentials/browse/?credential_types=certification",
      "selection": "Current Azure-prefixed exams and the SC-100 Azure security architecture credential that the official catalog does not return under the Azure product facet, represented by one row for each required exam.",
      "last_verified": "2026-08-31"
    },
    {
      "id": "hashicorp-current",
      "vendor_id": "hashicorp",
      "catalog_url": "https://developer.hashicorp.com/certifications",
      "selection": "Every certification listed in the current HashiCorp certification catalog.",
      "last_verified": "2026-08-31"
    },
    {
      "id": "databricks-current",
      "vendor_id": "databricks",
      "catalog_url": "https://www.databricks.com/learn/certification",
      "selection": "Every current certification listed in the official Databricks certification catalog, added one source-validated guide at a time.",
      "last_verified": "2026-09-01"
    },
    {
      "id": "aws-current",
      "vendor_id": "aws",
      "catalog_url": "https://docs.aws.amazon.com/aws-certification/latest/examguides/aws-certification-exam-guides.html",
      "selection": "Every exam guide in the current official AWS index, including overlapping current and announced replacement versions while each remains schedulable or publicly documented for launch.",
      "last_verified": "2026-09-01"
    },
    {
      "id": "red-hat-first-wave",
      "vendor_id": "red-hat",
      "catalog_url": "https://www.redhat.com/en/services/certifications",
      "selection": "One current public-objective performance exam from each selected first-wave specialization: Enterprise Linux, Ansible, OpenShift administration, cloud-native development, and AI.",
      "last_verified": "2026-09-01"
    },
    {
      "id": "comptia-first-wave",
      "vendor_id": "comptia",
      "catalog_url": "https://www.comptia.org/en-us/certifications/",
      "selection": "Tech+, both independently published A+ V15 component exams, Network+, Security+, Linux+, and Cloud+ using each current exact exam page.",
      "last_verified": "2026-09-01"
    },
    {
      "id": "linux-foundation-first-wave",
      "vendor_id": "linux-foundation",
      "catalog_url": "https://training.linuxfoundation.org/certification-catalog/",
      "selection": "The selected first wave of LFCA, LFCS, CKA, CKAD, and CKS; bundles, translated duplicates, and unrelated catalog products are excluded.",
      "last_verified": "2026-09-01"
    },
    {
      "id": "google-cloud-expansion",
      "vendor_id": "google-cloud",
      "catalog_url": "https://cloud.google.com/learn/certification",
      "selection": "The seven agreed foundational, associate, and professional expansion anchors plus Professional Agentic Architect while its public beta contract is active; Google Workspace, database, developer, DevOps, network, security-operations, and data-practitioner certifications remain future breadth candidates.",
      "last_verified": "2026-09-02"
    },
    {
      "id": "cisco-expansion",
      "vendor_id": "cisco",
      "catalog_url": "https://www.cisco.com/site/us/en/learn/training-certifications/certifications/index.html",
      "selection": "The agreed first Cisco expansion: CCST Networking, CCST Cybersecurity, CCNA, and CCNA Automation. Adjacent support-technician, cybersecurity, professional, specialist, and expert credentials remain future breadth candidates.",
      "last_verified": "2026-09-02"
    },
    {
      "id": "snowflake-expansion",
      "vendor_id": "snowflake",
      "catalog_url": "https://learn.snowflake.com/en/certifications/",
      "selection": "The agreed Snowflake expansion: preserve the retired SOL-C01 Associate page and its non-certification Platform Skills Badge replacement, then cover current COF-C03 Core, DEA-C02 Advanced Data Engineer, and GES-C02 Gen AI. Retired COF-C02 and GES-C01 are excluded as current targets.",
      "last_verified": "2026-09-02"
    },
    {
      "id": "isc2-expansion",
      "vendor_id": "isc2",
      "catalog_url": "https://www.isc2.org/certifications/exam-outlines",
      "selection": "The agreed ISC2 expansion: entry-level CC, practitioner SSCP, cloud-specialist CCSP, and broad senior-practitioner CISSP. Passing an exam is kept separate from each credential's experience, endorsement, membership, ethics, and continuing-education requirements.",
      "last_verified": "2026-09-02"
    },
    {
      "id": "nvidia-expansion",
      "vendor_id": "nvidia",
      "catalog_url": "https://www.nvidia.com/en-us/learn/certification/",
      "selection": "The agreed NVIDIA expansion: associate Generative AI LLMs and AI Infrastructure and Operations, followed by professional AI Operations with its integrated hands-on labs. Other active and coming-soon NVIDIA credentials remain future breadth candidates.",
      "last_verified": "2026-09-02"
    },
    {
      "id": "salesforce-expansion",
      "vendor_id": "salesforce",
      "catalog_url": "https://help.salesforce.com/s/articleView?id=005298929&language=en_US&type=1",
      "selection": "The agreed Salesforce expansion: current Platform Administrator, Platform App Builder, Platform Developer, and Agentforce Specialist credentials. Salesforce's seasonal exam releases and annual maintenance requirements are tracked independently from the stable credential names.",
      "last_verified": "2026-09-02"
    },
    {
      "id": "mongodb-expansion",
      "vendor_id": "mongodb",
      "catalog_url": "https://learn.mongodb.com/pages/certification-program",
      "selection": "The agreed MongoDB expansion: Associate Developer, Associate Data Modeler, and Associate Atlas Administrator. The current self-managed Associate Database Administrator remains future breadth. Detailed study guides are free after enrollment; public exam contracts and learning paths remain separately monitored.",
      "last_verified": "2026-09-02"
    },
    {
      "id": "servicenow-expansion",
      "vendor_id": "servicenow",
      "catalog_url": "https://learning.servicenow.com/kb?id=kb_article_view&sysparm_article=KB0012292",
      "selection": "The agreed first ServiceNow expansion: the foundational Certified System Administrator and platform-development Certified Application Developer mainline credentials. Product-specific Implementation Specialist, micro-certification, accreditation, and expert-program credentials remain future breadth. Current public blueprint knowledge articles are required; official training and MeasureUp practice access are recorded separately.",
      "last_verified": "2026-09-02"
    },
    {
      "id": "palo-alto-networks-expansion",
      "vendor_id": "palo-alto-networks",
      "catalog_url": "https://www.paloaltonetworks.com/services/education/certification",
      "selection": "The September 2, 2026 public role-based portfolio contains two shared foundational certifications plus Network Security, Security Operations, and Cloud Security professional, specialist, and architect credentials. Inventory all 17 current titles, and use Cybersecurity Apprentice as the first public-datasheet pilot. Legacy PCCET, PCNSA, PCNSE, and other retired product-era exams are not current targets.",
      "last_verified": "2026-09-02"
    },
    {
      "id": "fortinet-expansion",
      "vendor_id": "fortinet",
      "catalog_url": "https://www.fortinet.com/training-certification",
      "selection": "The September 2, 2026 post-transition portfolio has 19 current certifications: NSE 1 through NSE 4, four solution-track certifications at each of NSE 5, NSE 6, and NSE 7, NSE 8 Cybersecurity Expert, plus MSSP Security and OT Security industry certifications. Inventory certifications rather than every versioned product exam. Use NSE 4 FortiOS as the first guide because its public FortiOS 7.6 Administrator page exposes a complete weighted exam topic table. FCF, FCA, FCP, FCSS, and FCX remain historical credentials after the July 15, 2026 transition, not parallel current targets.",
      "last_verified": "2026-09-02"
    },
    {
      "id": "splunk-expansion",
      "vendor_id": "splunk",
      "catalog_url": "https://www.splunk.com/en_us/training/certification.html",